<?xml version="1.0" encoding="utf-8"?>
<xs:schema xmlns:xs="http://www.w3.org/2001/XMLSchema"
	targetNamespace="http://www.uniovi.es"
	xmlns="http://www.uniovi.es"
	elementFormDefault="qualified">
	<xs:element name="circuito">
		<xs:complexType>
			<xs:sequence>
				<xs:element ref="nombre" />
				<xs:element ref="longitud" />
				<xs:element ref="anchura" />
				<xs:element ref="fecha" />
				<xs:element ref="hora" />
				<xs:element ref="vueltas" />
				<xs:element ref="localidad" />
				<xs:element ref="país" />
				<xs:element minOccurs="3" maxOccurs="unbounded" ref="referencia" />
				<xs:element minOccurs="1" maxOccurs="5" ref="fotografía" />
				<xs:element minOccurs="0" maxOccurs="3" ref="vídeo" />
				<xs:element ref="coordenadas" />
				<xs:element ref="tramos" />
			</xs:sequence>
		</xs:complexType>
	</xs:element>
	<xs:element name="nombre" type="xs:string" />
	<xs:element name="longitud">
		<xs:complexType>
			<xs:simpleContent>
				<xs:extension base="xs:string">
					<xs:attribute name="unidad" type="xs:string" use="required" />
					<xs:attribute name="valor" type="xs:decimal" use="required" />
				</xs:extension>
			</xs:simpleContent>
		</xs:complexType>
	</xs:element>
	<xs:element name="anchura">
		<xs:complexType>
			<xs:simpleContent>
				<xs:extension base="xs:string">
					<xs:attribute name="unidad" type="xs:string" use="required" />
					<xs:attribute name="valor" type="xs:decimal" use="required" />
				</xs:extension>
			</xs:simpleContent>
		</xs:complexType>
	</xs:element>
	<xs:element name="fecha" type="xs:date" />
	<xs:element name="hora" type="xs:time" />
	<xs:element name="vueltas" type="xs:integer" />
	<xs:element name="localidad" type="xs:string" />
	<xs:element name="país" type="xs:string" />
	<xs:element name="referencia" type="xs:anyURI" />
	<xs:element name="fotografía" type="xs:anyURI" />
	<xs:element name="vídeo" type="xs:anyURI" />
	<xs:element name="coordenadas">
		<xs:complexType>
			<xs:simpleContent>
				<xs:extension base="xs:string">
					<xs:attribute name="latitud" type="Latitud" use="required"  />
					<xs:attribute name="longitud" type="Longitud" use="required" />
					<xs:attribute name="altitud" type="Altitud" use="required" />
				</xs:extension>
			</xs:simpleContent>
		</xs:complexType>
	</xs:element>
	<xs:simpleType name="Latitud">
		<xs:restriction base="xs:decimal">
			<xs:minInclusive value="-90"/>
			<xs:maxInclusive value="90"/>
		</xs:restriction>
	</xs:simpleType>
	<xs:simpleType name="Longitud">
		<xs:restriction base="xs:decimal">
			<xs:minInclusive value="-180"/>
			<xs:maxInclusive value="180"/>
		</xs:restriction>
	</xs:simpleType>
	<xs:simpleType name="Altitud">
		<xs:restriction base="xs:decimal">
			<xs:minInclusive value="0"/>
			<xs:maxInclusive value="5000"/>
		</xs:restriction>
	</xs:simpleType>
	<xs:element name="tramos">
		<xs:complexType>
			<xs:sequence>
				<xs:element minOccurs="1" maxOccurs="unbounded" ref="tramo" />
			</xs:sequence>
		</xs:complexType>
	</xs:element>
	<xs:element name="tramo">
		<xs:complexType>
			<xs:sequence>
				<xs:element ref="distancia" />
				<xs:element ref="coordenadas" />
				<xs:element ref="sector" />
			</xs:sequence>
		</xs:complexType>
	</xs:element>
	<xs:element name="distancia">
		<xs:complexType>
			<xs:simpleContent>
				<xs:extension base="xs:string">
					<xs:attribute name="unidad" type="xs:string" use="required" />
					<xs:attribute name="valor" type="xs:decimal" use="required" />
				</xs:extension>
			</xs:simpleContent>
		</xs:complexType>
	</xs:element>
	<xs:element name="sector" type="xs:string" />
	
</xs:schema>